{
  "type": "object",
  "properties": {
    "fixture_format": {
      "const": "0.1"
    },
    "schema_id": {
      "type": "string",
      "minLength": 1
    },
    "schema_version": {
      "type": "integer",
      "minimum": 1
    },
    "tick": {
      "type": "integer",
      "minimum": 0
    },
    "entity_ids": {
      "type": "array",
      "items": {
        "type": "integer",
        "minimum": 1
      },
      "uniqueItems": true
    },
    "columns": {
      "type": "object",
      "minProperties": 1,
      "additionalProperties": {
        "type": "array",
        "items": {
          "type": "integer",
          "minimum": 0,
          "maximum": 4294967295
        }
      }
    }
  },
  "required": [
    "fixture_format",
    "schema_id",
    "schema_version",
    "tick",
    "entity_ids",
    "columns"
  ],
  "additionalProperties": false,
  "$schema": "https://json-schema.org/draft/2020-12/schema",
  "$id": "urn:sutekh:world-fixture:0.1"
}
