{
  "fixture_format": "0.1",
  "schema_id": "rts",
  "schema_version": 1,
  "tick": 0,
  "entity_ids": [
    1,
    2,
    3,
    4
  ],
  "columns": {
    "kind": [
      1,
      1,
      1,
      1
    ],
    "team": [
      0,
      0,
      0,
      0
    ],
    "hp": [
      12,
      12,
      12,
      12
    ],
    "pos_x": [
      1000,
      1000,
      1000,
      1000
    ],
    "pos_y": [
      1000,
      1000,
      1000,
      1000
    ],
    "speed": [
      16,
      16,
      16,
      0
    ],
    "range_sq": [
      0,
      0,
      0,
      0
    ],
    "reload": [
      6,
      6,
      6,
      6
    ],
    "cooldown": [
      0,
      0,
      0,
      0
    ],
    "damage": [
      3,
      3,
      3,
      3
    ],
    "flight": [
      2,
      2,
      2,
      2
    ],
    "order_mode": [
      0,
      0,
      0,
      0
    ],
    "order_x": [
      0,
      0,
      0,
      0
    ],
    "order_y": [
      0,
      0,
      0,
      0
    ],
    "formation_slot": [
      4294967295,
      4294967295,
      4294967295,
      4294967295
    ],
    "formation_gen": [
      0,
      0,
      0,
      0
    ],
    "formation_ox": [
      16384,
      16384,
      16384,
      16384
    ],
    "formation_oy": [
      16384,
      16384,
      16384,
      16384
    ],
    "goal_x": [
      1065,
      1064,
      1063,
      1200
    ],
    "goal_y": [
      1000,
      1000,
      1000,
      1000
    ],
    "anchor_x": [
      0,
      0,
      0,
      0
    ],
    "anchor_y": [
      0,
      0,
      0,
      0
    ],
    "anchor_valid": [
      1,
      1,
      1,
      1
    ],
    "target_slot": [
      4294967295,
      4294967295,
      4294967295,
      4294967295
    ],
    "target_gen": [
      0,
      0,
      0,
      0
    ],
    "target_dist_sq": [
      0,
      0,
      0,
      0
    ],
    "target_valid": [
      0,
      0,
      0,
      0
    ],
    "target_x": [
      0,
      0,
      0,
      0
    ],
    "target_y": [
      0,
      0,
      0,
      0
    ],
    "truncated": [
      0,
      0,
      0,
      0
    ],
    "proj_active": [
      0,
      0,
      0,
      0
    ],
    "proj_left": [
      0,
      0,
      0,
      0
    ],
    "proj_target": [
      4294967295,
      4294967295,
      4294967295,
      4294967295
    ],
    "proj_target_gen": [
      0,
      0,
      0,
      0
    ],
    "proj_damage": [
      0,
      0,
      0,
      0
    ],
    "dmg_out": [
      0,
      0,
      0,
      0
    ],
    "dmg_target": [
      4294967295,
      4294967295,
      4294967295,
      4294967295
    ],
    "dmg_target_gen": [
      0,
      0,
      0,
      0
    ],
    "incoming": [
      0,
      0,
      0,
      0
    ]
  }
}
