{
  "fixture_format": "0.1",
  "schema_id": "demo.actor",
  "schema_version": 1,
  "tick": 0,
  "entity_ids": [
    1,
    2,
    3,
    4,
    5
  ],
  "columns": {
    "position_x": [
      0,
      4294967295,
      0,
      4294967295,
      5
    ],
    "velocity_x": [
      4294967295,
      0,
      0,
      4294967295,
      9
    ]
  }
}
